{
 "version": "v1",
 "note": "`topicId` depends on `prerequisiteId` (the prerequisite). Directed edges of a DAG.",
 "edgeCount": 381,
 "dependencies": [
  {
   "topicId": "eg_measurement_noise",
   "prerequisiteId": "eg_forward_model",
   "strength": "soft",
   "reason": "Noise is the part of the data the forward model cannot predict"
  },
  {
   "topicId": "eg_inverse_problem",
   "prerequisiteId": "eg_forward_model",
   "strength": "hard",
   "reason": "Inversion runs the forward model backwards"
  },
  {
   "topicId": "eg_inverse_problem",
   "prerequisiteId": "eg_measurement_noise",
   "strength": "hard",
   "reason": "Noise is what makes many models acceptable"
  },
  {
   "topicId": "eg_prior",
   "prerequisiteId": "eg_inverse_problem",
   "strength": "soft",
   "reason": "The prior is the second input of an inversion, beside the data"
  },
  {
   "topicId": "eg_likelihood",
   "prerequisiteId": "eg_forward_model",
   "strength": "hard",
   "reason": "The likelihood compares data with the forward model's prediction"
  },
  {
   "topicId": "eg_likelihood",
   "prerequisiteId": "eg_measurement_noise",
   "strength": "hard",
   "reason": "The noise distribution sets how fast the likelihood falls off"
  },
  {
   "topicId": "eg_posterior",
   "prerequisiteId": "eg_prior",
   "strength": "hard",
   "reason": "The posterior updates the prior"
  },
  {
   "topicId": "eg_posterior",
   "prerequisiteId": "eg_likelihood",
   "strength": "hard",
   "reason": "The likelihood carries the information from the data"
  },
  {
   "topicId": "eg_posterior_crowd",
   "prerequisiteId": "eg_posterior",
   "strength": "hard",
   "reason": "The crowd is a picture of the posterior"
  },
  {
   "topicId": "eg_posterior_shape",
   "prerequisiteId": "eg_posterior_crowd",
   "strength": "hard",
   "reason": "The shape is what the crowd outlines"
  },
  {
   "topicId": "eg_true_vs_reference",
   "prerequisiteId": "eg_posterior",
   "strength": "hard",
   "reason": "The reference posterior is a posterior"
  },
  {
   "topicId": "eg_true_vs_reference",
   "prerequisiteId": "eg_measurement_noise",
   "strength": "hard",
   "reason": "Noise is why the posterior is not centred on the true value"
  },
  {
   "topicId": "eg_model_error_intro",
   "prerequisiteId": "eg_forward_model",
   "strength": "hard",
   "reason": "Model error is an error of the forward model"
  },
  {
   "topicId": "eg_model_error_intro",
   "prerequisiteId": "eg_measurement_noise",
   "strength": "hard",
   "reason": "It is defined by contrast with noise"
  },
  {
   "topicId": "eg_credible_region",
   "prerequisiteId": "eg_posterior",
   "strength": "hard",
   "reason": "A credible region is a region of the posterior"
  },
  {
   "topicId": "eg_coverage",
   "prerequisiteId": "eg_credible_region",
   "strength": "hard",
   "reason": "Coverage is a property of credible regions"
  },
  {
   "topicId": "eg_coverage",
   "prerequisiteId": "eg_true_vs_reference",
   "strength": "hard",
   "reason": "Coverage is measured against the true value"
  },
  {
   "topicId": "eg_why_samplers",
   "prerequisiteId": "eg_posterior_crowd",
   "strength": "hard",
   "reason": "Samplers produce the crowd"
  },
  {
   "topicId": "eg_bayes_multiply_curves",
   "prerequisiteId": "eg_posterior",
   "strength": "hard",
   "reason": "The picture is of prior × likelihood"
  },
  {
   "topicId": "eg_data_bands",
   "prerequisiteId": "eg_likelihood",
   "strength": "hard",
   "reason": "A band is where the likelihood of one datum is high"
  },
  {
   "topicId": "eg_data_bands",
   "prerequisiteId": "eg_bayes_multiply_curves",
   "strength": "soft",
   "reason": "The 2-D picture generalises the 1-D one"
  },
  {
   "topicId": "eg_gaussian_posterior_conditions",
   "prerequisiteId": "eg_data_bands",
   "strength": "hard",
   "reason": "Straight bands come from a linear forward model"
  },
  {
   "topicId": "eg_gaussian_posterior_conditions",
   "prerequisiteId": "eg_posterior_shape",
   "strength": "soft",
   "reason": "A Gaussian is one of the posterior shapes"
  },
  {
   "topicId": "eg_tradeoff",
   "prerequisiteId": "eg_data_bands",
   "strength": "hard",
   "reason": "A trade-off is a long band that no other datum cuts"
  },
  {
   "topicId": "eg_funnel",
   "prerequisiteId": "eg_posterior_shape",
   "strength": "hard",
   "reason": "The funnel is one of the shapes"
  },
  {
   "topicId": "eg_gaussian_flat_smooth",
   "prerequisiteId": "eg_gaussian_posterior_conditions",
   "strength": "soft",
   "reason": "Uses 'Gaussian' in the posterior sense"
  },
  {
   "topicId": "eg_posterior_zoo",
   "prerequisiteId": "eg_posterior_shape",
   "strength": "hard",
   "reason": "The zoo is a catalogue of shapes"
  },
  {
   "topicId": "eg_posterior_zoo",
   "prerequisiteId": "eg_tradeoff",
   "strength": "soft",
   "reason": "The ridge is a trade-off"
  },
  {
   "topicId": "eg_posterior_zoo",
   "prerequisiteId": "eg_funnel",
   "strength": "soft",
   "reason": "The funnel is in the zoo"
  },
  {
   "topicId": "eg_random_variable",
   "prerequisiteId": "eg_measurement_noise",
   "strength": "soft",
   "reason": "Noise is the first random variable of the course"
  },
  {
   "topicId": "eg_expectation",
   "prerequisiteId": "eg_random_variable",
   "strength": "hard",
   "reason": "The mean is a property of a distribution"
  },
  {
   "topicId": "eg_variance",
   "prerequisiteId": "eg_expectation",
   "strength": "hard",
   "reason": "Variance is an expectation of squared deviations"
  },
  {
   "topicId": "eg_quantiles",
   "prerequisiteId": "eg_random_variable",
   "strength": "hard",
   "reason": "Quantiles are read from the cdf"
  },
  {
   "topicId": "eg_gaussian",
   "prerequisiteId": "eg_variance",
   "strength": "hard",
   "reason": "The Gaussian is set by its mean and σ"
  },
  {
   "topicId": "eg_heavy_tails",
   "prerequisiteId": "eg_gaussian",
   "strength": "hard",
   "reason": "Tails are judged against the Gaussian"
  },
  {
   "topicId": "eg_chi_square",
   "prerequisiteId": "eg_gaussian",
   "strength": "hard",
   "reason": "χ² assumes Gaussian residuals"
  },
  {
   "topicId": "eg_covariance",
   "prerequisiteId": "eg_variance",
   "strength": "hard",
   "reason": "Covariance generalises variance to two quantities"
  },
  {
   "topicId": "eg_multivariate_gaussian",
   "prerequisiteId": "eg_covariance",
   "strength": "hard",
   "reason": "The covariance sets the ellipse"
  },
  {
   "topicId": "eg_multivariate_gaussian",
   "prerequisiteId": "eg_gaussian",
   "strength": "hard",
   "reason": "It is the Gaussian in several dimensions"
  },
  {
   "topicId": "eg_eigen",
   "prerequisiteId": "eg_multivariate_gaussian",
   "strength": "hard",
   "reason": "Eigenvectors are the axes of the Gaussian ellipse"
  },
  {
   "topicId": "eg_positive_definite",
   "prerequisiteId": "eg_eigen",
   "strength": "hard",
   "reason": "Positive definiteness is read from the eigenvalues"
  },
  {
   "topicId": "eg_positive_definite",
   "prerequisiteId": "eg_covariance",
   "strength": "hard",
   "reason": "It is a property of covariance matrices"
  },
  {
   "topicId": "eg_lognormal",
   "prerequisiteId": "eg_gaussian",
   "strength": "hard",
   "reason": "Its logarithm is Gaussian"
  },
  {
   "topicId": "eg_joint_marginal_conditional",
   "prerequisiteId": "eg_random_variable",
   "strength": "hard",
   "reason": "These are distributions of random variables"
  },
  {
   "topicId": "eg_independence",
   "prerequisiteId": "eg_joint_marginal_conditional",
   "strength": "hard",
   "reason": "Independence is defined through joint and marginals"
  },
  {
   "topicId": "eg_uncorrelated_not_independent",
   "prerequisiteId": "eg_independence",
   "strength": "hard",
   "reason": "Contrasts independence with correlation"
  },
  {
   "topicId": "eg_uncorrelated_not_independent",
   "prerequisiteId": "eg_covariance",
   "strength": "hard",
   "reason": "Correlation is defined from the covariance"
  },
  {
   "topicId": "eg_bayes_rule",
   "prerequisiteId": "eg_joint_marginal_conditional",
   "strength": "hard",
   "reason": "Bayes' rule follows from conditioning"
  },
  {
   "topicId": "eg_bayes_rule",
   "prerequisiteId": "eg_posterior",
   "strength": "soft",
   "reason": "It formalises posterior ∝ prior × likelihood"
  },
  {
   "topicId": "eg_gaussian_conditioning",
   "prerequisiteId": "eg_multivariate_gaussian",
   "strength": "hard",
   "reason": "Conditions a multivariate Gaussian"
  },
  {
   "topicId": "eg_gaussian_conditioning",
   "prerequisiteId": "eg_bayes_rule",
   "strength": "hard",
   "reason": "Conditioning is Bayes' rule"
  },
  {
   "topicId": "eg_kalman_gain",
   "prerequisiteId": "eg_gaussian_conditioning",
   "strength": "hard",
   "reason": "The gain appears in Gaussian conditioning"
  },
  {
   "topicId": "eg_lln",
   "prerequisiteId": "eg_expectation",
   "strength": "hard",
   "reason": "The average converges to the expectation"
  },
  {
   "topicId": "eg_mc_error",
   "prerequisiteId": "eg_lln",
   "strength": "hard",
   "reason": "Monte Carlo error says how far the average still is from the expectation"
  },
  {
   "topicId": "eg_mc_error",
   "prerequisiteId": "eg_variance",
   "strength": "hard",
   "reason": "It scales with σ"
  },
  {
   "topicId": "eg_ess",
   "prerequisiteId": "eg_mc_error",
   "strength": "hard",
   "reason": "ESS is defined through the Monte Carlo error"
  },
  {
   "topicId": "eg_clt",
   "prerequisiteId": "eg_lln",
   "strength": "hard",
   "reason": "Both describe averages of many draws"
  },
  {
   "topicId": "eg_clt",
   "prerequisiteId": "eg_gaussian",
   "strength": "hard",
   "reason": "The limit is the Gaussian"
  },
  {
   "topicId": "eg_averaging_fails",
   "prerequisiteId": "eg_clt",
   "strength": "hard",
   "reason": "Shows where the theorem's condition fails"
  },
  {
   "topicId": "eg_averaging_fails",
   "prerequisiteId": "eg_heavy_tails",
   "strength": "hard",
   "reason": "The Cauchy is an extreme heavy-tailed case"
  },
  {